How do I read / download webpage content?,url,bufferedreader,bufferedwriter,malformedurlexception,inputstreamreader,,,,
How do I get data types supported by database?,databasemetadata,connection,resultset,drivermanager,,,,,
How do I print a file using the default registered application?,desktop,file,,,,,,,
How do I turn the Num Lock button on?,toolkit,keyevent,,,,,,,
Instantiate unknown class at runtime and call the object’s methods,class,method,,,,,,,
XML How to Add CDATA data ,element,cdatasection,document,documentbuilderfactory,transformerfactory,,,,
JavaFX Creating a Sprite Animation,interpolator,transition,imageview,duration,,,,,
How do I format a number with leading zeros?,numberformat,decimalformat,,,,,,,
Append string to a text file,printstream,bufferedoutputstream,fileoutputstream,file,,,,,
Check if an image is readable,image,imageicon,,,,,,,
how to read ISO Latin-1 Encoded Data,bufferedreader,inputstreamreader,fileinputstream,,,,,,
How to Create Text move animation,pane,scene,keyvalue,keyframe,timeline,application,vpos,stage,font
Handle Shape drag and drop events,application,group,scene,circle,line,setstrokelinecap,,,
