Convert a tiff into a buffered image (Java),ImageIO
Checking whether an element exist in an array,Arrays
How to Store the Insert query of hibernate with session save method in String,System
Why can't I draw an ellipse with this code?,Graphics
Generic object returned instead of class entity in hibernate query,List
How to get the path of a directory where my running jar file is?,CodeSource
How to set a double format by locale,String
How convert table into string?,Arrays
Java reflecting on method scope variables,Class
How to find maximum value of set of variables,Math
How to get timezones in IANA format in java?,ZoneId,TimeZone
How to shuffle list of images?,File
adding elements in a list to another list,ArrayList
Run batch file from Java code,Runtime
How to get the current date/time in Java,System,Calendar,LocalDateTime,ZonedDateTime
Java Program that runs commands with Linux Terminal,Runtime,JOptionPane
java Runtime.exec to run shell script - cannot open file,Runtime
Sorting an object ArrayList by an attribute value in Java,Collections
Java Rectangle Issue,Graphics,Graphics2D
How to get the insert ID in JDBC?,Statement
How do I use nonstatic methods?,Graphics
Java comparator interface and initializing comparator,Arrays
How to Draw an BufferedImage to a JPanel,Graphics
Java mouse motion anywhere on screen,MouseInfo
Changing labels with resource bundle,ResourceBundle
How to get maximum value from double data type value set?,Collections
Parsing formatted Date String in another TimeZone to date object not working,DateFormat,Date
How do I copy a 2 Dimensional array in Java?,Arrays
Sort collection by two different properties,Comparator,Collections
Android Eclipse Java comparing array contents with string. Not working?,String
Getting error in parsing an XML file using JDOM,DocumentBuilderFactory
Unable to run TestNG test case in Eclipse with ChromeDriver,System
Java how to sort a list of array: List<Object[]>,Collections
Execute php from java program,Runtime
Java array sorting by classes,Comparator,Collections,Arrays
issue with date and time zone how to get date without time zone?,Locale
how to insert into set without changing the equals and hashcode,TreeSet
Get first character of each word and its position in a sentence/paragraph,Character
How do I make HttpURLConnection use a proxy?,URL
To search a particular file in PDF document using Java,String
Result Set to text file using java,OutputStreamWriter,BufferedWriter,Reader
Collect all values of a Set field,Stream
How to convert a list of strings into a list of objects?,Collectors,String
draw image in applet,Thread,JLabel
How to use Data URI from Image as an InputStream?,DatatypeConverter
Triangle Draw Method,Graphics
How can I get height and width of an image?,ImageIO
How do I properly use this Image code?,ImageIO
How can I parse a string for a set?,Arrays
How to create item objects from reading a text file?,List,Integer
How should equals and hashcode be implemented when using JPA and Hibernate,System
How to get last n elements of a Treemap,TreeMap
Value of a field of Java object dynamically (by reflection),Field
How to convert a file directory into a List of InputStreams with Java 8,File
How to reflectively invoke PrepareStatement.set,Method
How to make a copy of a file containing images and text using java,InputStream
How to get exactly element in array?,TreeSet
making jfilechooser show image thumbnails,FileView
Java monitoring multiple folders,WatchService
Sort a LinkedList of objects by object's variable,Collections
Java Scaling Font with AffineTransform,Font,AffineTransform
How to print an array of ArrayList in Java?,Arrays,Object
XML attribute Parsing,Node
Call a method of an attribute object inside a parent object,Field
How do I avoid .clone()?,Arrays
How to sort an ArrayList using multiple sorting criteria?,Collections
How set values of array as parameters?,System,Arrays
How to remove all elements in String array in java?,Arrays
Casting the return from a java reflection method invocation,Class
How to remove object from array,System
App crash when try to connect to DB with JDBC,DriverManager
Read and Write a large Image,ImageReadParam,ImageWriter
"List of entries, how to add a new Entry?",Map
Deserializing objects and adding it to an array,ObjectInputStream
How can I get the current date and time in UTC or GMT in Java?,Date
How to add an item after another item in List?,List
"Java sockets, sending data to and from?",Writer,DataInputStream,BufferedReader
SVG Circle Resolution in Java,ImageIO
Java Array List and object passing,Object
Sort Map of a Map based on property,Collections
Java design pattern to check for integer sign,Math
How to get value from Map key in java,Map
Convert time into milliseconds,Calendar
Java (JAXP) XML parsing differences of DocumentBuilder,Socket,DocumentBuilder
Trouble parsing an XML file with a compiled XPATH expression?,XPath
How to store result set from sql statement in two different variable and use?,ResultSet
Simulating random events in Java,Math
Connecting JAVA App to SQL SERVER,DriverManager,Connection,ResultSet
Connecting to MySQL database in Java,DriverManager
how to create folders for a specific user on a web application container?,File
convert byte to image,ImageIO
Convert a X509 Public key to RSA public key,BigInteger
How do I replace a substring that occurs after a certain number of spaces in a string?,String
Common java class for json communication from server to client,ResultSet
Passing a Class as an argument to a method that returns and ArrayList of objects of that Class,EnumMap,Class
How to convert image path into image on JLabel,DefaultTableModel
New to java. How to add the item to specific repositories using a text file,ArrayList
Keeping the rectangle within JFrame,Random,Math
Getting error while executing the docker command from java program,Runtime
Calculating the distance between two squares on a grid - Java,Math
Reading Strings from a file to an ArrayList then converting to an Array,Arrays
How to commonly address primitives and objects,Integer
"How do I edit a XML node in a file object, using Java",Document
Using an image in a JAR file,Class
Open excel document in java,Desktop
Using ImageIO.read with a redirecting URL,URL
"In TCP MultiThreaded Server, if a client gets service ,how to find the port number of servicing socket?",Socket
"java.awt.Graphics, how to define position?",Graphics
Java - comparing a string input,Scanner
How to clone a synchronized Collection?,Collections
How to remove String from an array by checking length and comparing text in Java?,Arrays
How do I read x bytes from a stream?,DataInputStream
how to create backup of postgres database using java,Process,Runtime
Order a list of objects,Collections
How to add to an arraylist of linkedlists?,String
Open a PowerPoint file contained in a JAR file,Class
how to get a JTextField to check if the text is equal to an int,Integer,String
Cost of inserting element at 0th position of LinkedHashSet?,Collections
Getting Null pointer Exception while using the Java mail api to send mail from local host using gmail smtp.,Hashtable
how to convert BigInteger to String in java,BigInteger,String
Copying files with Java,Files
Serializing Java DOM Document to XML: Add CData Elements,OutputKeys,package-summary
Joda: convert the system date and time to date/time in another zone,Date
How to decompress a byte Array in Java,InputStream
What is the correct way to convert a Shape to a Rectangle2D.Double?,Double
Getting all foreign keys corresponding to a table and the tables that hold those foreign keys with JDBC,DatabaseMetaData
How do I update a properties value in java without deleting other variables,Properties
How to use sort an ArrayList using Comparator? The variable i'm sorting by is an int,Integer,Comparator,Comparable
Can I set the file index to the start of the file?,InputStream
Java Date Parse from one to another format,Date
How to the contents of an applet into an image?,SwingUtilities,ImageIO
how to sort a string alphabetically java,Arrays
Redirect to my site,Desktop
Parsing JTextfield String into Integer,Integer
How to convert a number to a string collection,Integer,String,Character,List
Cast via reflection and use of Class.cast(),Class
Creating a hashCode() Method - Java,List
How to add element to the middle of the array using Iterator in Java?,System
executing bash commands from a specific directory,ProcessBuilder,Runtime
how to read private key for digital signature,Key
Sign string with PEM PrivateKey,Signature
PaintComponent not working for drawing shapes,JComponent
Get value inside from a objects method in arraylist in Java?,String
How do I check if a string contains at least one character from another string?,Pattern
socket closed exception after transferring one file from server to client,DataOutputStream,DataInputStream
How to get the class type for which a collection object is created using reflection,Method
how can I return the next for loop item for this method?,Iterator
Error running linux command from java,Runtime
Java applet repaint a moving circle,Thread
How to get the count of keys for values in a hash map using lambda,Collectors,Stream
Accessing a Java Resource as a File,File
Program to get all files within a directory in Java,File
Passing a method-reference to an objects constructor,AbstractButton
Executing a shell script with an empty argument from Java,Runtime
How to use stream to filter a collection in a range,List
How do I convert an ISO 8601 date time String to java.util.LocalDateTime?,DateTimeFormatter
How to rotate text with Graphics2D in Java?,Graphics2D
jaxb unmarshal abusable by crafted xml when using default sax parser?,Unmarshaller
How can I abort a running JDBC transaction?,Statement,Connection
"Java apache commons FTP, how to download image file to BufferedImage",ImageIO
Loading a ResourceBundle within an OSGi bundle,ResourceBundle
Unexpected ArrayStoreException,System
How to compare item of set collection to current Date?,Date,String
Sorting an arraylist of hashmap according to a value field of the hashmap,Collections
How to compare arraylist with Hasmap and get the key from Hashmap based on value?,List
How to Digitally Sign a Dynamically Created PDF Document Using PDFBox?,ByteArrayOutputStream
sorting a list name and date using comparator,Collections
How to remove text in arraylist element after a specific character?,String
How to sort a collection using Collection.sort(),Collections
java code to get ip address class,Pattern
How to access a specific element while using a List of a List of a primitive data type in Java,Arrays
Creating a Truetype Font file with javafx,Font
save resized image java,ImageIO
remove whitespaces inside XML tag with java,DocumentBuilderFactory
Filter json file and save to arraylist android,String
Sorting an array of int in lexicographic order,Arrays
A method for obtaining an object of type Class,Object,Class
How can I rotate a Rectangle?,AffineTransform
How to avoid methods inherited from Object class in Java when examining a class with reflection?,Class
Sort TreeMap based on values?,Collections
multiple Servers TCP in java,ServerSocket
Generate public and private key using a string,String
How to convert string representing number i any format to integer,Integer
How to determine last element when using an iterator?,Iterator
How to check which JTree is selected in mouse clicked event?,JTree,EventObject
How do I format a Currency for a Locale in Java,NumberFormat
Parsing time string with SimpleDateFormat,Date
How to find the number of uppercase Characters in a string array?,Character
How to check if the file is an image,ImageIO
run a executable jar file within java program using class loaders,System
Set class fields by database columns,ResultSet
Saving parameters in a file,Class
How to convert String to byteArray and byteArray to String Array in java?,Byte
How to convert a String to an int in Java?,Integer
Sort by nested Array size inside nested Map,Entry
Stopping JUnit suite if particular test fails,System
How do I get this 2D Array to rotate to the right 90 degrees?,Stream
How to sort the first elements of List of Lists in alphabetical order?,Collections
Reading XML files in Java,JAXBContext
How to access resource files from jar file,Class
How to create valid image from RGB pixel values using java,BufferedImage
How to deserialize synchronizedMap and synchronizedList?,Collections
How to parse a string that is in a different encoding from java,String
Java enum reflection when enum is inside a class,Class
Executing 'adb logcat' command using Runtime class,Runtime
How to sort data sets Java,Collections
How to create PQ sorted according to the natural ordering of a list?,PriorityQueue
How to find sum of the digits of a binary value in a single string,Integer
How should I call a Perl Script in Java?,Runtime,Process
Java Frame with Image and Progressbar,Thread
how to convert string of integers and Lists to arrayList,Integer
Finding angle from center point on circle,Math
How to convert date format to milliseconds?,Date
How much does Java Graphics drawImage consume?,ImageIO
How to sort categories Arraylist?,Collections
How can I validate a local date time within daylight savings time?,ZonedDateTime
How to run sed command from java code,ProcessBuilder
Server not reading client messages,BufferedWriter
How can I get access to a private array using Java reflection?,Field
How to search a string of key/value pairs in Java,String
How to send Image data type via socket in java,ImageIO
How to fetch a single data with sql in java NetBeans,Statement
Method to iterating through classes in a package using Reflection,Class,System
How to reverse an ArrayList from a file?,Collections
How to access a particular element in JLIST?,ListModel
How to make a rectangle in Graphics in a transparent colour?,Color
How to set a default value for items list?,Arrays
Geometry Area Calculator,Object
Substring of a phrase in a sentence in Java,String
build and execute a bash script from a java script with spaces,Runtime
Sorting and comparing integer arrays in Java,Arrays
How do I get the file name from a String containing the Absolute file path?,File
Signed Hexadecimal to decimal in Java,Integer,Long
How to write the contents of my array in a text file?,Object
How to Zoom specific area of Image on Canvas in Swing,BufferedImage
Can I remove an enum value with if it has been save with a JDO entity?,Enum
How to map List of objects to Map of values from the given object using java 8,Collectors
Finding an element in an array in Java,Arrays
How do I fetch specific bytes from a file knowing the offset and length?,RandomAccessFile,String
How to write Iterator for a list?,System
Getting a variable by name using reflection in Java,Field
How do I determine the host from my Java applet?,Applet
How to check if a list contains a sublist in a given order in Java,Collections
How to convert an integer into 24 hours format in JAVA?,String
How do I substring this array?,String
can any process read the target file when my java process renaming the source file,Files
Sort date and time values,Arrays,LocalDateTime
execute multiple commands in cmd using java,ProcessBuilder
Good hashCode() Implementation,Object
Java: How can I load files using Scanner?,Scanner
Fast loading of PNG image into an array in java,ImageIO,BufferedImage,DataBufferInt,ImageReader
How to get the previous key/value and the next key/value in Maps,TreeMap
compare an String and an array element in java,String
SimpleDateFormat parsing a non date String,DateFormat
Is it possible to implement the hashCode() method in this case?,Object
How should I concatenate arrays,System
Sorting an array in reverse order - not reversing,Arrays
Arraylist of objects - how to add objects with duplicate values,Map
"Set a value in a class with reflection, with the Class, Field and value as parameters in a method",Field
Label and Text differences in JavaFX,cssref
Using java to run multiple commands in terminal?,Runtime
How to read UTF strings from web,InputStreamReader
How to concatenate path to base url when a url redirects?,URI
How to Read 1st line of a file with BufferedReader?,BufferedReader,List
How to Convert FileTime to String with DateFormat,FileTime
Is it possible to call NSIS script in java Swing Program,Runtime
How to move 3 buttons inside a window,JComponent
Not able to Run Shell Script,Runtime
How can I set the System Time in Java?,System
How to get the clients ip address from the server?,DatagramSocket
How to parse both Date and Time in using gson?,ZonedDateTime
How to display a PNG properly on JFrame,Frame
Can the constructor call of an anonymous class have arguments,Thread
How to retrieve the absolute path of a file stored inside the jar,ClassLoader
"SocketServer and Socket Communication, Answer Not received",PrintWriter
Executing commands using Java Runtime,ProcessBuilder
how to retrieve currency format values from JformattedTextfield,NumberFormat
What is socket bind and how to bind an address,ServerSocket
Parsing a text file into strings (JAVA),Scanner
Display an image in java,ImageIO,Class
Execute jar file from inside a Java program,Runtime
Is clone() in java shallow copy?,Object
How to plot graph in java and to save as Image,ImageIO
Comparing calendar objects,Calendar
Java comparable not working in List,Collections
How to lock a file then clear its contents?,RandomAccessFile
How to generate a checksum for an java object,Object
How to display an images instantly in Java Applet?,ImageIO,Applet
How to list the files in current directory?,File
HTTP requests with basic authentication,Authenticator
Load localized resources,ResourceBundle
How do I write a modified image with the same compression settings as the source image,ImageIO
Reflection invoke throws IllegalArgumentException,Method
Java: SAX ignores schema validation,DefaultHandler
How to grow Labels within a VBox,Region,VBox
How do you set one array's values to another array's values in Java?,System
convert string into date format,DateFormat,SimpleDateFormat
How to convert byte array to buffered image,ImageIO,ImageReader
Using Insertion Sort to sort an array,System
Reconstructing private and public keys with Bouncy Castle?,Key
"Getting the field ""length"" in a Java array using reflection",Class
Trying to sort integers in a list from user input,Collections
Thread.sleep in JUnit test case,LocalDate,Clock,Thread
Outputting to a text file in Java,FileWriter
Changing output into 4x4 matrices,Integer
sort list in list with comparator,List
Remove the underline from a JLabel text,TextAttribute
How to retrieve data from a database and store in a variable Java?,List
How to convert an offset from GMT to the local timezone?,TimeZone
How can I sort array using comparable?,Arrays
download file with multiple connections,RandomAccessFile
Sorting a Map by value in Java,Collections
How to remove elements of one map from another map?,Map
How to get XML node by ID and NamedNodeMap - Java DOM XML,Document
Java Swing Scrolling By Dragging the Mouse,Window
Using Comparator to sort the List of Objects,Collections,Arrays
How to parse end of line string in Java,BufferedReader
SimpleDateFormat parses a string to wrong time,SimpleDateFormat,Date
How do I pass a variable between JavaFX to javaScript?,WebEngine
java reflection to invoke a method that takes a Comparable[] argument,Method
How to sort a collection that uses Guava Range values as keys?,TreeMap,TreeSet
How can RMI client sees and get all dynamic remote objects registered in a registry?,Context,Naming,Registry
Why doesn't this return the position for the largest item in the array list,String
Get text element inside JList to a variable?,ListModel
Display and writing of image in java,ImageIO
How to create a map from list with java-streams?,Function
IOException error when creating a socket in java,InetAddress
JTextArea and JTextPane font rendering,UIManager
Sort Java String array by multiple numbers,Collections
Why does my quicksort sorts the array in a reverse order?,Collections
Java Reflection: How can i get the all getter methods of a java class and invoke them,Introspector
How to paint an Image that from a JFileChooser?,JLabel
"Java Graphics: Constructing FontMetrics from Font, without a Graphics2D",BufferedImage
How to validate an XML against schema using JAXB?,Unmarshaller
java swing for client,JFrame
Digest authentication in Android using HttpURLConnection,Authenticator
How to include the script file in the jar,Runtime
How can I format a double to something using comma and euro symbol,NumberFormat
How can I know which security provider is handling my SSL socket?,SSLContext
trying to connect to mysql database,Class
How to effectively replace Java HashMap with boolean values,Map,HashMap
Load a properties file in a jar file,ClassLoader,Class
Accessing properties of subclasses and superclasses in java with reflection,Class
How do maps check keys?,Object
Need to use collections to sort colors by name and be hex value,BufferedReader,String,Map,Collections
How can I display a random line from a text file?,Math
How do I create a thread dump of a Java Web Start application,Thread
How pass and receive object from android to Java server by socket?,ObjectOutputStream,ObjectInputStream
How to embed a perl script inside a jar file for execution?,Process,File
java String to an object,String
Create a list of key value objects,HashMap
I am trying to develop a chat application using socket Programming in single server and multiple Clients,Runtime,Thread
Comparing Array Values and HashMap,Arrays
Java soap client to wsdl url,Service
Read the JSON file in the Jersey sources folder,Class
How do I check if InetAddress was created using a hostname or an IP address?,InetAddress
How to use original hashCode() method after overriding it,System
Reflect Map in Java,Map
Can not project image on the exit screen,Thread
How can I create a stream from an array?,Arrays,Stream
How do I measure how long the program is executed,System
Removing elements from an ArrayList,Iterator
Problem with run DOS command in Java,Runtime
"How to get an array of current directory listing including file/directory name, last modified, and size in Java?",File
Sorting string using collection.sort in java,Collections
Slipt Formula String,String
How to Add a url Image to a JButton,JButton
Using data in BufferedImage that is drawn by Graphics,ImageIO
Java: Filling in a rectangle on a grid,JComponent,Graphics
How to send HTTPS request from GAE servlet?,URL
how to write the equals() of Comparator,Comparator,Object
How to get XML content as a String,Node
Accessing executing folder when running a jar file,System
Filtering a stream of pojos using values from a map,Set
Drawing a graphic on Glass Pane,JFrame
Sorting a list of objects in java,Collections
Two JPanels in one JFrame,SwingUtilities
Calculate a formula from a string,String
How to read the list of files/folders on a shared location?,File
Parse a string to date in specific format,DateFormat
Java Application with H2 Database,System
How do I compare strings in Java?,Objects,String
"Java: basic plotting, drawing a point/dot/pixel",BufferedImage
To use object call or static call in a function/method for java?,Integer
How to use Java Arrays.sort,Arrays
Perform java reflection on instantiated objects,Class
How to iterate a LinkedList elements in reverse order?,LinkedList
how to know a Java Socket is dead,Socket
How to parse number string containing commas into an integer in java?,NumberFormat,String
How to set disabled text color for JLabel?,UIManager
RLE Compression,StringBuilder
Drawing a line with Java swing draws multiple lines,Graphics
Java TreeSet sorting objects by value,Collections
how to remove java map value(not key) in java?,Map
how to show the list data in ascending order?,Collections
how to create a chat client in java,SwingUtilities
Parsing date from Calendar in Java,Date
Reading a Text File From a .jar File,Scanner
Sorting Strings using Collections.sort?,Collections
How to reassemble packets with Java NIO Sockets,SelectionKey
How to populate an ArrayList from words in a text file?,ArrayList
How do I maintain EOL characters when reading a from a text file?,Files,Paths
Serializing BigDecimal value using GSON,BigDecimal
How to put an output in a new line in an output text file,System
Java getting my IP address,InetAddress
Running a shell script from java code,Runtime
Background not changing color,Thread
How to save a image on JFrame,ImageIO
How to delete file when application is closed,File
How to copy multiple files with different extensions using Java 8?,Files
How can I get this datetime format in java,Date,DateTimeFormatter,OffsetDateTime
Rotate 90 degree to right image in java,AffineTransform
get data from client in server socket java,BufferedReader,InputStream,String
Run PHP script from Java and capture the output,Process
Encryption and decryption of image file,ImageIO
How sort an ArrayList of HashMaps holding several key-value pairs each?,Collections
How to find previous N siblings of an element,Node
Java Enum sorting descending to the value,Collections
How to store arrayList into an array in java?,Collection
secure socket communication in android,SSLSocketFactory
How to turn ImageIcon to gray on Swing,GrayFilter
How to parse date from string with year and week using java.time,DateTimeFormatter
Parsing XML file from resources,DocumentBuilder
"How can you obtain a randomized subset of a list in Java, without using Collections.shuffle?",Collections
