Convert millisecond String to Date in Java,Long
TreeMap sort by value,Map
How many people can connect to ServerSocket?,ServerSocket
Locating resources within a jar package,ClassLoader
Generate MD5 String in java,String
contains method for list of array of bytes,Arrays
Sorting based on value of object,Arrays
How to remove all null elements from a ArrayList or String Array?,Collections,Arrays
How do I generate a 160 bit prime number in java?,BigInteger
Insertion sort with an array of objects?,Comparable
Delete all files not modified in last ten days,Calendar,File
How to compare two calendars to check if the event happened today?,Calendar
PatternSyntaxException,Pattern
What method should I use to replace text within a String,String
Test console output using JUnit,System
how to set the file path in java,ImageIO
Using Java reflection to create eval() method,Class
How to list numbers after sorting in java,Collections
How to get the dynamic port number in Java for Socket client,Socket
Files.write appending string to text file,System
How to add a new line to text in Java?,JMenuItem
How to set a background picture in JPanel,ImageIO
How to use Java properties file to define objects and set the properties for the object?,Class
Check if a file is an image,Runtime
How to compare two URLs in java?,URI,URL
Merge Date and Time into Timestamp,System
Serializing an object that includes BufferedImages,ImageIO
Localized date format in Java,DateFormat
Failing to load resource when running java program from command line,ClassLoader,StreamSource
How interface gets a method with body from Object class?,Object
"How to create a random 16 digits number, with specific first digits?",Math
How to break/pause reading of an image?,ImageIO
Calling Linked List class method in Driver class,Collections
JToggleButton - How to change the color?,UIManager
How to immediately change text of jLabel inside MouseEvent handler?,Thread
server that accepts multiple client - not working,BufferedReader
How do i compare values of BigInteger to be used as a condition in a loop?,BigInteger
Java with GSON - deserialize only the values into an ArrayList of a JSON string,Map,ArrayList
Common method for comparing any two Java objects,AccessibleObject
How change background color of JFrame,SwingUtilities,EventQueue
Java how to read folder and list files in that folder in jar environment instead of IDE,ClassLoader
How reading data into char array works?,Reader
Loading Constants from db and reading them in an include file,System
int arrays to json object in java,Object,Arrays
Access static final variable using reflection,Field
Getting XML Node text value with Java DOM,Node
How to best store a list of primitive values?,Number
How to get this Method object via reflection?,Class
Change colors for JProgressBar with Nimbus?,UIManager
Insert element into a double array,System
java Serialize Object to ByteArray,OutputStream
How do I use Java to read from a file that is actively being written to?,FileChannel
What is the difference between connection and read timeout for sockets?,Thread
Android currency format returning different currency symbol,NumberFormat
Array in the reverse order,Collections
How to draw an image on the applet,Applet
Webpage data scraping using Java,Integer
shell script not executing completely from java,ProcessBuilder,Process
how to extract an element of JTextArea,JTextArea
IP Address not obtained in java,NetworkInterface
How to sort a csv file on a field that contains double data type value on Java?,Collections
Cannot Serialize/Deserialize ArrayList,ByteArrayOutputStream
How do I sort a custom ArrayList in Java?,Collections
Different Enter and mouse click event,KeyEvent
how to connect multiple databases on a single server with JDBC?,Connection
How to parse an ISO date with LocalDateTime.parse(...),LocalDate
URL to load resources from the classpath in Java,URL,Thread
Create a map from a list of maps,Collectors
How do I wait for Threads to complete execution in Java?,Thread
"Hashcode , equals contract in java",Object
How to serialize String to an existed ByteBuffer efficiently?,CharsetEncoder
Simple RMI Server with SSL,System
How to sort an arrayList of objects by their components in java,String,Arrays
How to sort Objects in an Arraylist with an Object parameter,Collections
How to read namespace as it is in a xml using XMLStreamReader?,XMLStreamReader,StartElement
Adding to a HashSet when it is the value of a HashMap,Arrays
How to use the Comparator interface in Java?,Collections
how to use escape characters for patterns read from file in java,Pattern
Trying to replace a char by another into a map,Collections
Java Graphics2D Transparent Rendering,Graphics2D
JAXB and document object,Unmarshaller
Why the image is not displayed?,ImageIO
ServerSocket connection with more than one client,ExecutorService
How to securely store a PrivateKey in code,Mac
Instance set in Java?,Collections
create a server application having gui,SwingUtilities
Date format in java,Long
Javascript to java code not working,Integer
Sorting a string array and a int array,Arrays
how to convert calendar object to a specific time zone,Calendar
java method accepts array of objects and a double then returns an array of objects,System
How to encrypt a file in java using AES,Cipher
How do I add a parameter to the end of an array?,System
Sorting a list of objects with the order of an List of object-Ids,Collections
Retrieving some particular tables from database,DatabaseMetaData
How to find index of ArrayList item in String Array,Arrays
How to move (large) files between file systems in Java?,File
How can I create an SHA512 digest string in Java using bouncy castle?,Security
Returning an instance of a parameter class using generics,Class
How do I get localized date pattern string?,SimpleDateFormat,DateTimeFormatter
Format a local date at another time zone,LocalDateTime
Integer.parseInt not parsing a string into integer,Scanner,Character
Java web application i18n,MessageFormat
How to sort double array with another string array?,Arrays
What does super's clone do?,Object
How to create an ArrayList of Classes?,Class
16 bit hex string to signed int in Java,Integer
Resolving ip-address of a hostname,InetAddress
"JavaFX Polygon Translation, Rotation, Scaling and its Points",Node
FTP connect with no username and password?,URL
Saving BufferedImage using zip compression,ImageIO
Java 8: How to sort and collect two nested Maps with ArrayList inside?,Entry
How to call each array within an ArrayList and sort ArrayList by age?,Collections
How to make enums use their compareTo method when they implement an interface?,Collections
Given that an Object is an Array of any type how do you test that it is empty in Java?,Array,String
java hmac/sha512 generation,DatatypeConverter
"How do you use the crypt library in C for DES encryption? (setkey, encrypt, crypt, etc.)",Cipher
RSA encrypt with base64 encoded public key in Android,Cipher
How does overriding equals and hashCode impacts storing data in a Map in Java with a bad hashing function?,System
How to grant user permission in Policy?,Subject
How to ignore some tags in XML in Jaxb,XMLInputFactory
Zipping Files using util.zip No directory,File
How to do an Integer.parseInt() for a decimal number?,Double,Float
Map as value in ConcurrentHashMap,Collections
Java: Reading images and displaying as an ImageIcon,ImageIO,Toolkit
How to sort a Vector of Vectors?,Collections
MySQL Database Query in JAVA,Arrays
How to sort a Collection of generic Pairs,Collections,Integer
How can I exchange the first and last characters of a string in Java?,String
How to sort ArrayList of integers without regardless of positive and negative values,Math,Collections
How to map single tag to multiple fields in JAXB,Unmarshaller
JAXB mapping Map with complex object to JSON,StreamSource
problem in adding image to JFrame,SwingUtilities
java token if statement,Arrays
How to reverse a list in Java?,Collections
How do I compare and order two arraylists in Java,Collections
Decreasing an int by a percentage?,Math
Array Sorting Descending Order,Arrays
How to sort an ArrayList?,Collections
Why does this not return the IP address?,Runtime
BufferedImage colour change,BufferedImage
How do I convert a Java 8 IntStream to a List?,IntStream
Socket Programing java - how much time socket connection is alive? And how can I control it?,Socket
Rotating the Rectangle object in java,AffineTransform
How do I convert from int to String?,Integer,String
How to delete a node from a linked list,Scanner
Java/JAXB: How can I serialize a class into a well-formatted xml document?,Marshaller
JPA Cascaded Update/Delete of OneToMany,Collection
How can I get the Object from a Field/Class using reflection?,Class
Tomcat auto unpack WAR file changed the last modified time of files,TimeZone
"how do i create a copy of an object in java, instead of a pointer",Object
List handling inside a class,Collections
"Enums, Classes, Reflection, and Generic Casting",Class
Using Java with Matlab: passing Class type as a method argument,Object,Class
Object Serialization/Deserialization and FileInputStream.available(),InputStream
Iterating a list of Strings in Java,String
How can I call a MySQL stored function from Java?,CallableStatement
Reading txt file contents and storing in array,Scanner
Writing to file,Writer
How to get database schema name when using oracle jdbc connection?,DatabaseMetaData
How to convert ISO8601 format into milliseconds?,Instant,Duration
How can I get an integer from a string in Java?,Byte,Long
Android: Encrypt a string with AES 256bit Encryption with iv and secret key,Cipher
How can I know client send FIN package in socket?,Socket
How do I change the color of the tooltip for only one component?,JComponent
How to compare String to all elements in an array?,Set
Opening a file output stream on a file that is already locked overwrites it,FileOutputStream,FileChannel,StandardOpenOption
Java how to read part of file from specified position of bytes?,RandomAccessFile
write to file?,FileOutputStream
How to put multiple values in Map from a list,Map
How to merge lists of Map with Lists values using Java Streams API?,package-summary,Collectors,Collector
How to store the content of a JTextArea into a class?,DocumentListener,DocumentEvent,Document,JTextComponent
How to produce a map from a stream of the entries?,Collectors
How to share data between applets in the same web page?,AppletContext
How to load a jar file at runtime,URLClassLoader
How do I resize an imageview image in javafx?,index
How do I cast an array of doubles into an array of integers in Java?,Math
Interrupt java thread running nashorn script,Thread
"Reading from stdin and sending with UDP, creating two-way communication",Console
How to check a uploaded file whether it is a image or other file?,ImageIO
How to validate date string in java,DateFormat
Calling a method using reflection and return back the map,Method
How to copy from a string to another string in Java?,String
Deep copying and genetic algorithm,Object,Arrays
How do I write a code for random intervals between a range using numbers in double format?,Thread
Sorting custom class array-list string using Collections.sort,String,Collections
Reading from an Input File to an Integer Array,Scanner
How do I add thread to my server?,Executors
SQLException deleting row from JTable and database,Statement
Reading from a file using a Scanner and a method,List
How to compare time string with current time in java?,LocalTime
"Fire a JButton with spacebar, or enter key, or mouse click",JRootPane
How do I use java.util.Scanner with integers,Scanner
How to convert Strings in functions in Java?,Class
"Using streams, how can I map the values in a HashMap?",Collectors
How to know whether SFTP was successful or not in WinSCP,Runtime
Sort ArrayList in descending order,Integer
Reflect a list value into another list?,Field
connecting to multiple databases using different jdbc drivers,DriverManager
How to handle windows file upload using Selenium WebDriver?,KeyEvent
How to store a pdf file in postgresql database using servlets?,PreparedStatement
How to parse a string number into a BigDecimal,BigDecimal,DecimalFormat
Getting the methods of a class,Class
implementation of put method in a hashmap,HashMap
How to replace the first word from each sentence (from input file),String
How to add two label with preferred size to a panel by using BorderLayout?,JPanel
How to Instantiate Joda DateTime from TimeZone String ID and Epoch,System
How to create a Raster from a pixel float array in Java?,WritableRaster
Java Swing moving java.awt.Shape,AffineTransform,Graphics2D
Creating an instance using the class name and calling constructor,Class
Use an array to call a constructor with varargs,Class
Sorting object by name using Java comparable,Arrays
Running sudo command from Tomcat servlet,Runtime
Java sort map or array,Collections
Sort Java List/Map by order in which items are in an XML File,Collections
Align text in JLabel to the right,JLabel
Java reflection get all private fields,Field
How do I set the type of reference for the list?,Array
Parse conf file Java,Properties
"Insert object element into array in ordered position, without using sort algorithm in Java",Arrays
Creating new object in abstract class in Java,Class,Constructor
Trying to sort a priority queue by one of the stored nodes' values,Comparator
Sort List of Objects by values from array;,Collections
Compare Types using Reflection,Field
use cmd commands in java program,Runtime
How to compare one character from a string with another string,String
Java 8 Date and Time: parse ISO 8601 string without colon in offset,DateTimeFormatterBuilder
How to get element index when using a stream to traverse a list?,List
What CSS syntax do I need to use to access the Label of a TitledPane in JavaFX?,cssref
How do I split sentence in java by word(with parenthesis)?,Pattern
SAX parsing problem in Android... empty elements?,ContentHandler
Adding elements of an Array to an ArrayList,Arrays
What buffers to use for receiving an input stream from a Socket created by ServerSocket?,ServerSocket
How to efficiently filter and collect to a resulting map with differently derived map values from a few maps?,Stream
Apply color for Selected Text using JTextPane,StyledDocument
closing of Jframe when clickig a jbutton,Window
Server closes socket after handshake completed,Socket
How to use two maps and make another map?,Function
How to have a list of selected items of JList?,JList
Drawing images with float coordinates,AffineTransform
How do I set the statement if to read letters instead of numbers?,Scanner
How to get the current date and time of your timezone in Java?,TimeZone
How to set properties to Groovy script which is executable from Java code?,Runtime,System
How do I convert a ResultSet in a List of Hashtable?,ResultSet
Java TCP server not receiving packets until client disconnects,BufferedReader
MessageDigest NoSuchAlgorithmException,MessageDigest
How can I get screen resolution in java?,Toolkit
How can I test if an array contains a certain value?,Arrays
How do I find out if first character of a string is a number?,Character
Inverting file contents?,Files
How can I lock a file using java (if possible),FileLock
how to return a collection,Collections
How to create a file Path from a folder Path,Path
How to add one day to a date?,LocalDateTime
How to set Text Format?,String,Formatter
How to sort Items in ListView,Collections
How to pass an object with an unknown type to a Class with an unknown type,Object
Parse String containing a Number into a INT,Integer
How do I correctly get a URL for a resource on the classpath in WebSphere 6.1?,Class
Why won't my Java JDBC to Firebird database connection disconnect?,Integer
How do I write an array to a file?,PrintWriter
Java - Passing a class as a parameter,Class
Is it possible to reflect a java method statically?,Arrays
How to add a double value and a list element which is in double?,List
How do i get an integer to set the value the same as a scanner,Integer
Collections.sort() affects all ArrayLists. How do I sort only one list and not the others?,Collections
How to display an image in a frame?,Image
How to instantiate inner class with reflection in Java?,Class
Parsing a Directory of files - Check for a String,File,String
How to send date and time to SQL using java,CallableStatement
Java Reflection calling constructor with primitive types,Integer
How to use a method from a generic object list iterator to call another class' equals method,Object
Way to change transparency with java swing.image,ImageIO,ImageIcon
Search and Replace a content in a file in JAVA,String
How to wrap text in a JTextArea,JTextArea
JTable cell text color changing,JTable,TableColumn
Running a Inix command in a particular directory,Runtime,ProcessBuilder
"Java 8 epoch-millis time stamp to formatted date, how?",DateTimeFormatter
Comparing two strings as the last differential in a comparator?,String
Java: use clipboard to copy-paste java objects between different instances of same application,index
How to execute commands using java,Runtime
How to convert an int array to String with toString method in Java,Arrays,String
Finding if an array contains all elements in another array,Arrays
"How to Read CSV file in java using Jackson Library ,JSON",ClassLoader
Setting text in JLabel in a loop,Thread
java parse date time with milliseconds into date getting parse error,String
"How to read from text file, split strings from integers and then pass integers into an arraylist?",Integer
how to parse this string in java?,String
convert epoch time to date,TimeZone
How to output an string of ArrayList into a new file?,System
How to 'Get' a Specific Point From A Shape Object Derived from AffineTransform,AffineTransform
How to format Gregorian date using SimpleDateformat,Locale
How can I encrypt a PDF using Java?,InputStream
How can I copy a file and the directory structure where it exists?,File
How to set a textfield text from main method in netbeans?,EventQueue
Reverse bytes order of long,Long
how to know if array contains a value that is given,Arrays
Compare a Date with three or more Date(s) in Java 8?,Collections
JDBC: How to retrieve the result of SQL COUNT function from the result set?,ResultSet
How do I allow a user to input strings into an array until they hit enter with no text input?,BufferedReader
How to organize RMI Client-Server architecture,Naming
How to set path for image in any system to get image,File
Loading images using an InputStream,ImageIO
How to extract a single file from a remote archive file?,ZipInputStream
How to retrieve elements from sorted TreeSet using Binary Search?,TreeMap,TreeSet
Java localizing number formatting,JComponent
Load an image into a JPanel in an applet,JLabel
Check if client socket is closed on the server,PrintWriter
How to change the color of a single JProgressBar in Nimbus?,UIManager
How to keep the order of elements in hashtable,Collections
How move first item of arraylist to last position?,Collections
"How to sort a List of objects by their date (java collections, List<Object>)",Collections
How do I extract a date from a UUID using Java?,UUID
How to assign a value to byte array,String
How to populate an array with a ten digit number,String
Download file to tomcat server from URL,System
"Sort the values in a map of type Map<String, List<String>>",Comparator,Collections
How to parse/format dates with LocalDateTime? (Java 8),LocalDateTime
How to sort by two fields in Java?,Collections,String
How to list only N files in directory using java,File
Casting a class using reflection in java,Class
Getting a list of accessible methods for a given class via reflection,Class
Drawing point matrix too slow in Java AWT Canvas,Thread
How to interrupt BlockingQueue?,Thread
How could I know the status of the socket connection inside a PrintWriter,PrintWriter
Writing xml string with StAX,XMLStreamWriter
Running a .bat file in Java,Runtime
How do I read pixels from a PNG file?,Raster,ImageIO
Spring integration mail inbound channel,Thread
How to loop over a Class attributes in Java?,Class
How to get a list of all timezone IDs in Java 8,ZoneId
JTable: How to get the cell as a component for a given position,TableCellRenderer
About getting IP address by name,InetAddress
javascript comma operator in java,Math
How to shuffle list except an element?,Collections
Shell Script output is in different directory,ProcessBuilder
How do you send an array to an arraylist?,Object
How can I get a non-inclusive subset of a List?,Stream
How to reorder the pages of a PDF file?,String
TitledBorder border color and width using UIManager,UIManager
How to create Listview in Java?,JList
java comparator for arrays sort,Arrays
How to see if an object is an array without using reflection?,Class,Arrays
Put the line at previous position,Files,Collections
JAVAFX how to update GUI elements (nodes),Platform
Not sure how to use swing to draw rectangles,JComponent,Graphics
How do I set a Calendar with TimeZone?,TimeZone
Connect to a secure database using JDBC,DriverManager
how to delete specified character in array and copy the elements to another array,Arrays,Character
Listing only files in directory,File
How can I check if a method is static using reflection?,Modifier
Reflection - Getting New Instance of unknown classes with unknown number of constructor parameters,Class
How to blur a portion of an image with JAVA,BufferedImage
Modifying previously set CSS style of JEditorPane,DefaultStyledDocument,StyleConstants
how to add a value to a list of values for a single key in a hashmap (Java),Map
ArrayList contains() is not using equals() method of a class,Object
How to sort file names in ascending order?,Arrays
Sorting a LinkedHashMap keyset by values object property,Collections
How to put values from a text file into an object array in java?,List
How can I sort files in a directory in java?,Arrays
Java - Swing setting colour to text in JTextArea,JComponent
comparing two string in java,String
How to hide elements with in a JComboBox?,SwingUtilities
How to make SAXParser ignore escape codes,ContentHandler
Overriding hashcode method to return hashcode of variable in a class,Comparable
How to retrieve values from from a table with Foreign Keys in Java?,ResultSet
What is the equivalent of javascript setTimeout in Java?,Thread
Shape won't scale,Double
Invoking setText() through reflection only if an object has an specific annotaion,Class
How to create Full Screen width jtoolbar,Component
How to estimate execution time of method when it is invoked using Java Reflection,System
Unknown number of arguments of method in reflection,Integer,Double
Load .text file in string array,Files
Changing the colour of text in drawstring(),Graphics
How do I correctly get the largest and smallest numbers in a sequence of numbers?,Math
How do I set the position of the mouse in Java?,Robot
In Java how do you pass a String format variable placeholder to another String formatter?,Formatter,String
Signed int to 16 bit hex string in Java,Integer
Change JTable non Content background color,JTable
How to read/write .dat file within Jar file?,Class
reading cdata with binary data in xml by java,Base64
How to get the current Time and TimeZone from Locale?,Locale,TimeZone
"RSA decryption in Java, RSA libraries not used",BigInteger,Math
Parsing Date from String,Date
Java Graphics2D obtain rotated image bounding and new coordiinates,AffineTransform
Sorting ArrayList of Objects by Object attribute,Collections
Can one do a for each loop in java in reverse order?,Collections
How to change font size of all private JLabels,EventQueue
How to put contents in hashmap with in hashmap,String
Socket creation with same host,Runtime
How to copy file into another directory in java 8?,Files
Java object is not an instance of declaring class,Method
ordering image and text in jbutton,AbstractButton
"How do I move the circle to the ""WEST"" border layout frame?",ActionEvent,EventObject
How to grant dependent lib in jnlp file all permissions?,AccessController
Pass optional parameters to a CLI program - Java,String
Parsing Response XML with JAXB,Unmarshaller
Java reflecting nested anonymous classes,Field
How can i convert character 0s and 1s read from a txt File to byte?,Byte
How to Rotate AWT rectangle in JAVA?,AffineTransform
How to get previous element in a LinkedList?,LinkedList
File reading applet not running in browser,Class
Sorting an Array List of Arrays,Collections
How to load my properties file?,Properties
Java sorting an String Array by a Substring of characters,Arrays
How to compare two StringBuffer Objects using .equals() method?,StringBuffer
How to get a character from another character in java,Character
Function Object in Java ,Arrays
Java: reverse sorting without keeping the order,Collections
How to format Date with time zone in pattern string in java.time?,Instant
How to remove and replace an item in an array list in Java?,List
Java Graphics not drawing anything,SwingUtilities
Store indexes in an array,ArrayList
Constructor class thread safety in Java reflection,Constructor
How to overwrite a file in java,PrintWriter
How to start concurrent threads that acquire a file lock and wait on each other,Thread
Get my data from database in hashmap,HashMap
How to delete a file present in some directory in linux programmatically,File
Shell Script Won't Run From Java Program,Runtime
Fill rectangle with pattern in Java Swing,TexturePaint
