How can I consume for each elements of an optional list?,Collections
Regarding data read from TCP connection,InputStream
compare two numeric String values,Integer
Java: How to read a text file,Files,String,Integer,List
Dynamically call correct correct setter method with Reflection,Class
How to save digits after decimal point in double number,String
drawing boxes in java,Graphics
how to sort items of a MAP and remove one?,Collections
"In Java, how do I check if input is a number?",Integer
command does not execute successfully when run through java code using runtime.getruntime command,Runtime
Create View in specified MSSQL-Schema,Connection
Java: how to write/read encrypted password in/from a file,Arrays
Passing a class as an argument to a method in java,Class
What is the best way of deleting a section of a binary file in Java 7,FileChannel
Difference between SHA256withRSA and SHA256 then RSA,Files
How to set the list of ciphers and protocols to be used for sockets created by using HttpsURLConnection?,SSLContext
How to enlarge pixels? - Java,Image
Using a HashMap and reflection to call methods with variable argument types,Class,Constructor
java draw polyline from an arraylist of points,Graphics
"Using Java reflection, how do I get parameterized types of parameters to a Method?",Method
how to define an eclipse mask formatted text field?,Character
how to replace a dom node with new node?,Document
How to make HashMap work with Arrays as key?,List
how to put map values into list with different type?,Map
Compare and Sort String in array list,Arrays,Collections
Copying keys and values from one map to another map,ArrayList
How to ignore properties with empty values during deserialization from JSON,ConcurrentHashMap
Get the list of property of Object from List of Object dynamically in java,Method,Object
Java: Sorting a map,Collections
How to rename the name of attribute in a node of xml in java using dom parser,Element
How to insert newLine Between Text,String
How to copy a file to another location for later use (java),Files
Sort TreeMap by key using order CASE_INSENSITIVE_ORDER,TreeMap
Android JDBC MySQL get tables by Database,Connection
How to convert HEX into two digits format?,String
how to do verify using java.security.Signature,Signature
How to have rotated Ellipse shape in Java?,AffineTransform
instantiate class from class object,Class
How can I randomize the iteration sequence of a Set?,Map
Change Value Of A Field On Submit Using Javascript,Math
Adding Elements to List Java,Arrays
Sorting Arrays With Pairs of Numbers,Collections,Arrays
Sorting different objects by a common value,Collections
Using Reflection in factory pattern,Class
passing Strings to a command line program from java,Runtime
Java String equals,String
Parsing JSON data in Java,HashMap
How to decrypt a cryptojs AES encrypted message at the java server side?,DatatypeConverter
Why i can't connect to mysql database in java?,DriverManager
Java reflection: get class of field,Field
store object in ArrayList using another class,JOptionPane
"Java: SortedMap, TreeMap, Comparable? How to use?",Collections
Retrieve an image from the web in java,ImageIO
How to draw on a JLabel?,ImageIO
How to sort ArrayList using Comparator?,Collections
Java Paint Method Being Called By Graphics2D,Image
JavaMail Could not connect to SMTP host SSL 465: handshake_failure,System
Swing issues drawing 2 images,JComponent,JFrame
How to extract strings,String
"In JSP, what do the path and value attribute do within the input tag, and how does the form prefix affect them?",Object
How do i find how many times a substring is used in a string?,String
Ordering the items in the array,Arrays,Collections
how to remove an entry from hashmap by checking its value?,Iterator
Scanner: How do I limit the Scanner input after n characters?,String
Async sftp file transfer with Jsch?,CompletableFuture
Downloading image from Url in java.Server returned HTTP response code: 403 error. How can I get the connection to work?,ImageIO
Initial indexes of sorted elements of ArrayList,Collections
Modifying Property File,Properties
Add image icons to buttons/labels Swing,Class,ClassLoader
How to gracefully terminate a TestNG test?,Runtime
Sort colors by coordinates of a rectangle,Collections
Java Server Client Semantics,BufferedReader,ServerSocket
Loading files with ClassLoader,ClassLoader,Class
How do I clone a java byte array?,System
How to replace smilies in text such as :) with an image?,String
How to check if a value exists in an array in Java?,Arrays
How to compare and order list by date/time in java?,DateFormat,Collections
How can I convert an 2D int array into a 2D String array with Streams?,Arrays,IntStream
Best way to sort Map with Values,Map
adding animated GIF to swing label,Thread
Sending a screenshot (bufferedImage) over a socket in java,ImageIO
How to split a string into a map with a list of values?,String
FileNotFound exception,File,System
How to tokenize from a String of numbers to an int array,Integer
iterate on file inside a folder,File
Java replace line in a text file,System
"In Java, are fields of array type deep copied or shallow copied?",System
How to invoke a method which throws an Exception using Java Reflection?,InvocationTargetException
how to execute a command on a timer,Timer
JavaFX background colour not being set with CSS,cssref
How to take first word of new paragraph into consideration?,String
How to parse a date from a URL format?,Matcher
Sorting Java TreeMap by value not working when more than two values have the same sort-property,Comparator
how to create a properties file for keystore?,Properties
How to update the JTextField when the variable value is changed?,EventQueue
Improvements in gzip decompression java,StringWriter
Java Clipboard availability,Thread
How to create a process in Java,Runtime
Java Comparable interface: compareTo int attributes,Integer
How do I sort an array ignoring capitalization?,Arrays,String
How to use Calendar.getInstance with specified Locale,Calendar,GregorianCalendar
how to read multipart entity from android in jersey web service,Object
How to sort objects by different variables?,Collections,TreeSet
Spring Web Service - Web Service Communication,Thread
How to sort an arraylist of objects?,Long,Collections
How to get number of elements in byte array?,InputStream
ArrayList sort by length,Collections
Reversing integer array,Arrays,Object
Groovy script to run grails command,Runtime
How to convert a binary string back into a string,Integer,String
Adding objects to an arraylist using object elements,Collections
How to convert ResultSet into a useful integer?,ResultSet
How do i output the attributes of objects stored in a java vector?,Vector
add elements to Java Array,System
How to make sure if a TCP socket is closed on the other end? ( how to read ack signal),Socket
How do I split a string into an array the length?,String
Handling of java.awt.Color while saving file (JPG) with ImageIO.write,ImageIO
How do I create a file and write to it in Java?,index
Deleting a class object in java,System
"How do I get png image names, paths, heights, and widths from a directory of folders in java?",File
How do I draw an image in the shape of a parallelogram?,AffineTransform
Java Strings object in ArrayList,Collections
How can I change an int to a String for this object?,String,Integer
How to reload resource bundle in web application?,ResourceBundle
Capture image after double mouse click event,MouseEvent
Multiple File Uploader Java,File,JFileChooser
Can a Field class from Java reflection work on any object?,Field
Java Map with Integer keys: How are the keys compared?,HashSet,TreeMap
How to sort dates in a string array in Java?,Arrays
Java daemon - handling shutdown requests,ThreadPoolExecutor
Reading a File Into a Derby Database,Class,DriverManager
Cannot access Java resource when packaged in Mac app bundle,URL
reading a csv file into a array,Arrays
How to get depth of current node in JTree?,DefaultMutableTreeNode
Getting MD5 Hash of File from URL,InputStream
How to get a submap with LinkedHashMap?,Collections
Array in Java which has Javascript array-like nature,List,Collections
finding the angle of a triangle using tan,Math
Java: Returning an object from ScriptEngine javascript,Bindings
Java Graphics and Image explanation?,Component
Changing Color of a Java graphic object,Thread
A class attribute type of List which is not modifiable by accessor,Collections
java - Class whose name is known at compile time and which extends other class at runtime,Class
get IP address of java client in java server,InetSocketAddress,String
How can I create a sorted list of integer and string pairs?,Collections
How to implement comparator,Integer
How do you throw an instance of an Exception class created through reflection?,Class,Constructor
How do I convert a java.sql.Date object into a GregorianCalendar?,Calendar
How to use in replacement String in replaceAll method a matched text?,Matcher
ECDSA signature generation using secp256r1 curve and SHA256 algorithm - BouncyCastle,Signature
How can I use Lambda to convert a String array to Integer array?,String
How do I open and run a compiled Java file?,JarFile
Java Date Parsing from string,LocalDateTime
JAVA: Calling Unknown Object Class Method and Passing it's Parameters,Method
Using the Thread Object reference calling a Method,Thread
How to use some Jackson Deserializer in own custom Deserializer?,DateTimeFormatter
"How to sort a List<Enum, Collection> by order of an enum?",Collections
Socket tcp connection,Socket
Comparing two digested md5 strings returns false,String
How to split a string array into separate arrays in Java,Arrays
How to populate an array from each character in an element from another array?,String
How to set a GridPane to adjust automatically to content in JavaFX,GridPane
How to change icon image of button on mouse entered/mouse exit?,AbstractButton
How to connect a SSL socket through a HTTP proxy?,DataInputStream
How to replace null values in XML,String
Why can't Jericho parser parse this HTML code?,Collections
Java/JavaScript dates: Is this true?,Date
How can I get the width and the height of a JavaFX Label?,Region
Issue with XML child nodes iteration when mix of text and element nodes,Node
access JavaScript file in a java method in tomcat,ClassLoader
How do I create an empty folder in java?,File
How would I go about comparing two character that will convert to the same character?,Character
connection to mysql server failed,DriverManager
How to get screen position of a Swing element?,Component
Default Resource bundle is used for every locale?,Locale
Add each element in array to a list,Arrays
Server-client connection; what I'm missing?,BufferedReader
How to use Environment Variable to set file from Java code?,System
Best implementation for hashCode method,Float,Double
How to return a constant collection,Collections
How can the compareTo method work together with array.sort to sort an array?,Arrays
compare Long value in java,Long
How do I display the numbers in a for loop in a jLabel?,JLabel
How to implement a map with 2 independent keys?,HashMap
creating new instance of unknown class using property file,Object
Use String hashCode() Method?,String
Creating object from a given Class object in Java,Class
How to add JLabel to JEditorPane?,JTextPane,Component
How can I sort a Map by some property of the key in the map?,Collections
Parse 2d Json in java,Integer
How do I modify permissions to a shared folder with java?,Files
How to retrieve minutes from string date?,Integer
How to run linux commands in java code?,Runtime
Using constructors in Java,Object
Determine Object that Invokes an Event Handler,EventObject
Writing data to text file in table format,String
Daemon thread in java,System
How to cancel Files.copy() in Java?,Files,Thread
How to save an image in a set location?,ImageIO
How do I print out values of an array list in string?,Object
How to parse a text file in java?,String
How to gzip file in place replacement Java,File
How Can I Print Values and Index Numbers of an ArrayList without a Loop?,IntStream
Checking if a triangle is a right triangle,Math
"Invoke a bytecode class method, java",Class
Constructing Rectangle,Rectangle
How do I use Java streams to convert a set of strings to a set of maps?,Collections
"If socket created by ServerSocket.accept() is closed but the socket on client side isn't, will ServerSocket.accept() accept it again?",ServerSocket
getting the buttons in a gridPane and change their text using javaFx,GridPane
JTree - how to setBackground to node,JComponent
How Can I iterate this map in reverse direction,TreeMap
Why can't Javascript (running in Rhino) access methods on a java.lang.reflect.Method instance?,Method
Sorting of strings,Arrays
Sorting Array in natural order,Arrays
How to get an integer at a specified position in a string of integers?,Character
Draw Rectangle on pressing JButton,JComponent
Parsing ISO_INSTANT and similar Date Time Strings,DateTimeFormatter
How to read in all Files in a sub-directory using Files.walk exactly once?,Files,Paths
How to sort ArrayList Java,Collections
Comparable Class Java,Enum
How do I convert a integer representing a character to a string?,Integer,Character
JAVA - SSL - Client Certifcates,SSLContext
Calling the instance of a static method,Calendar
How to pass the date into GregorianCalendar in JAVA?,GregorianCalendar
Execute shell command in Tomcat,Runtime
How do you edit an element by index in a JList?,DefaultListModel
JLabel image fading out to a color,Graphics
How to add number of String values to an ArrayList?,List
Sort a ArrayList<String> by number value,Collections
how to search for a filename in a list of files,List,File,Files,Object
XML transformation without building a DOM,TransformerFactory
PDF Page re-ordering using itext,String,Formatter
Unique classes in generic list,Set
Sorting array with streams using reversed comparator,Comparator
Why do I need a connection to create PreparedStatements?,String
How HashMap replaces the value of a key without calling equals method,Object
How to get back Map from .txt file use Properties?,Properties
How to sort an array in reverse order using java?,Collections,Arrays
How to convert from org.joda.time.DateTime to java.time.ZonedDateTime,ZoneId
Java Rectangle Intersect Method,TextLayout
sorting an array list of int arrays in terms of the first and the second element of the int arrays,Collections
Java: How to compare two Times/Dates,Calendar,Date
Javascript and Java Date JSON serialization,Date
Write the contents of Arraylist to txt file in Java,StringBuilder
Java: how to write formatted output to plain text file,System
Java Game Development: Graphics,Thread
How to run a MySQL script using ProcessBuilder?,Runtime
How to convert image file into integer array in java?,BufferedImage,Raster
How to sort a Collection of Objects?,Collections,Arrays
how to read a csv file and display its contents in java translucent swing window?,SwingUtilities
socket programming serialized objects,ObjectOutputStream
"Filling A Circle On The Outside, Inside Becomes Transparent",Graphics
how could I add item(as a first item) to arrayList,Arrays
"Implementing a LinkedList of a specific class, instead of generic type",Collection
How to implement a Java stream?,Stream,package-summary
How to do spaces between text/components for JPanel?,JLabel
Is there a way to list all directories from which fonts are loaded in java?,GraphicsEnvironment
Java Android - How to sort a JSONArray based on keys,Collections
How to create a secure random AES key in Java?,KeyGenerator
How to repeat audio in Java?,AudioClip
Compare contents of two ArrayLists efficiently,List
How to convert military time integer to standard time string,Collections
How to sort by String value of object in Java,Collections
How to change default font in netbeans platform?,GraphicsEnvironment
Java Buffer Image form online Webcam,ImageIO
How do I make 2 comparable methods in only one class?,Collections
Do I need to delete tmp files created by my java application?,File,Files
how to convert List<object> into org.json.JSONArray?,Arrays,String
How to obtain text from a String variable?,System
Constructing objects in Java,System,PrintStream,String,Object,Rectangle
"Using jOOQ, how to get data type of a column by name",Comparator,Field
How to properly lock a resource while created in Java,ConcurrentMap
How to convert the position in JTextPane with HTMLDocument to position in JTextPane string text,HTMLEditorKit,HTMLDocument
How to transform hexadecimal string into Byte. Java,Byte
Reading properties from an XML file using Input Stream?,Properties
"How to sort an Object, which is really an array",Arrays
How to acces an item from a TreeMap using an int index?,Map
Reading from text field database doesn't work,Formatter
connection to Java DB always fails,Class
How to sort a map,Collections
Cast list of Object to list of class' type parameter,Arrays
Convert String in milliseconds to Date Object (JAVA),SimpleDateFormat
Java Draw Arc Between 2 Points,Math
Simulate multiple key-press combinations,Robot
Java how to remove element from List efficiently,Iterator
PostgreSQL persistent connection in Java (Using JDBC),DataSource
All super classes of a class,Class
String-array puts a comma after item text,Arrays
Convert Date string with Time to long date,Date
Singleton Test with JUnit,Character
Path for image loading,ImageIO
How to use ListSelectionListener in 3 table with database,JTable
Trying to cast an Image to a BufferedImage,ImageIO
JavaFX: CSS selector for text elements in TextFlow,cssref
Linking two Threads in a Client-Server Socket program - Java,SwingUtilities
Drawing a class that extends JPanel,BufferedImage
Make an ArrayList of class C from a List of interface I,Collectors
How to shuffle specific set of elements in a list?,Collections
Java Reflection for creating new objects,Class
How to create a new list and add a value in single statement,Stream,List
"""File In use"" error using Rhino/Java/JavaScript",Runtime
Monitoring file changes,Thread
Get all hostnames for an IP address in the network,InetAddress
Create image from BLOB using ImageIO?,ImageIO
How to convert a String into an ArrayList?,Arrays,String
How would I remove a shape from this array using the shape's area?,Object
Sorting of Strings using collections.sort() method,String,Collections
The best way to sort list by item name length,Collections
JavaFx draw Image inside in Pane,GraphicsContext,ImageView
How to use hash function in java for hashing the password?,Arrays
Pass Enum type value as a parameter in Java,Enum
"How to draw a circle, positioning it at a double value instead of a int?",Graphics2D
Adding a background Image to JPanel,JComponent
how do I access a resource file from a dependent jar?,Class
How to remove item from list based on attribute comparison?,Collections
Call a method when class name not known at compile time,Class
How to show Image as tooltip in JavaFX?,Tooltip
how do I set the default locale for my JVM?,Locale
Difficulty with socket communication from Server to Client,ServerSocket
How to find location of JTree node on screen,JTree
Sorting An Array of Pairs By The First Value in Java,Arrays
Running .bat in current cmd.exe from java application,Process
How can I get the timezone offset without the DST formatted correctly?,ZoneRules
How to run VBS function with parameters from Java and assign result to variable,Runtime
Java Server and Client Time,DateFormat
How to make a list thread-safe for serialization?,Collections
How can I convert an int array to an arraylist?,Arrays
How do I set a TextView to a Long Value?,String
Writing to text files in Java,System,String
"ScheduledThreadPoolExecutor, how stop runnable class JAVA",ScheduledThreadPoolExecutor
How to iterate through Map by values and if the values are same sort them by key?,Comparator,Collections
ArrayList of ArrayList of Integers in lexicographic order in Java,Collections
Are keys unique in resource bundles?,ResourceBundle
How to split a String into a Stream of Strings?,String,Arrays,Stream,Pattern
How to parse follow date in Java?,Locale
Valid Commands That Keep A Finally-block From Executing in Java,System
Executing jar file in java,Runtime
How to execute command with parameters?,Runtime
Moving a background image in Swing,Graphics
How do I convert a JTextField string to a double?,Double
java: Graphics2D version of polyline?,Graphics2D
Run a php script from a java class,Runtime
Why can't i compare java.util.Date to mysql dates?,System
Java how to draw and fill a Polygon which has holes,Area
How to convert ZonedDateTime to Date?,Date
loop over a subset of an enumeration in java,EnumSet
Is possible getMethods in order using reflections?,Collections
How to create a JavaFX Image from an absolute path?,Image
How to call MethodHandle.invokeExact() with an array of Object[]?,MethodHandle
How can I remove a substring from a given String?,String
"In Java, How to check if time is within two Date objects",Instant
How to Get UTC DateTime,Date
How to highlight all the text in a JTextPane?,JTextComponent
Deep Copy and Shallow Copy Java,System
Getting binary data directly off the windows clipboard,DataFlavor
Forcing static variable initialization at runtime,Class
Using SAX parser on xml file inside a zip,SAXParser,ZipFile
Call Javascript Popup in java program,JOptionPane
How to set a timeout on a BufferedReader with a socket stream,BufferedReader
How to turn 64 character string into key for 256 AES encryption,String
Java Server - Multiple ports?,ServerSocket,ServerSocketChannel
How to get sqlserver database name from datasource name in Java,Connection
Inserts an element into an array and returning the index reallocating the array in case of full array,System
How to get info about file compression using ImageIO?,ImageReader
How to put numbers in ascending order in an arraylist in Java?,Collections
How to serialize java.nio.file.Path with Gson?,Paths
How to create a Path and a File that does not Exist in Java,Files
Deleting a file using delete() - Java,File,System
More on equals and hashCode,Object
Reflection in constructor with inheritance (Java),Class
"How do I rotate a graphics object, without changing it's location?",Graphics2D
How can I read file.xml from the same package?,Properties
How do I empty a primitive array?,Arrays
Add the selected item of a popup menu to a text field which is in same form,JTextComponent
Simulate touch command with Java,File
How to use Array-list in String array?,Arrays
How do I write a method which would work on both lists and arrays?,Arrays
How to check if java hashtable contains key-value pairs from another hashtable,Hashtable,Set
Can't print the content at a specific index in an ArrayList object,Object
How to sort an ArrayList of users by userNumber,Collections
Copying an ArrayList of a Subclass to an ArrayList of a Superclass,Collection,ArrayList
How to convert string date in util.date format?,TimeZone
Array to JSON with Guava,Arrays
Load jar dynamically,URLClassLoader
How to shuffle an array,Collections
Using stream to sort by value return from method,List
Runtime.getRuntime().exec() output differ from executing a command line program directly,Runtime
How to shuffle the contents of an array,Arrays
How to force use of specific XML parser,DocumentBuilderFactory
Java Hashmap: How to get key from value?,Map,Entry
Encrypt file with FileReader,Base64
"KeyStore.load(InputStream stream, char[] password); How do I know the password on the client side?",KeyStore,Builder
How to display the date format in android?,String
Java code for getting Eastern date and time as date format to insert into database,TimeZone
How to display JRadioButton's array text,JOptionPane
Java comparing class instances,Set
Comparing two comparator objects in Java,Object
RMI : determine the IP address of a remote object,RemoteServer
How to rotate the square in my swing app,AffineTransform,Thread
Unable to search entity in lucene,Date
How to select an index value from a String Array in a JOptionPane,JOptionPane
add image to JFrame?,JComponent
Sorting List<> by numeric value,Collections
about drawing a Polygon in java,JComponent
Combining all text files in a folder into a single file,FileInputStream
Set text to random color & opacity javaFX,Node,Shape,Math
how to save csv like text file in an ArrayList to sort by name,Collections
Using mongodb with java,Iterator
How to use multiple JDBC drivers in the same application?,Class
Comparator.comparing for Map.Entry in Java 8,Collections
Loading classes and resources in Java 9,Module
Create template method that uses reflection to create object,Class
Cast from an Object ArrayList to Object Array in JSP,List
Java XML DOM: how are id Attributes special?,Attr
sort a hashmap by the Integer Value desc,Arrays
Java - Passing a method through a parameter,Callable
Map with objects as a key,Object
"Apache POI, Excel 2007+ XML, and OSGI",Class
Saving and retrieving time from client to database,Instant
How to use reflection to identify annotated methods?,Class
How to convert int to time in java,Formatter
Insert one list into another list in position,ArrayList,List
Lambda vs Anon vs Static Nested Class,Thread
Mongodb async java driver find(),CompletableFuture
java String.format: numbers with localization,Formatter,String
How would i getX() from a rectangle in a shape array list,Shape
Parse XML document securely,XMLConstants
Install fonts from a java program,Runtime
JavaFX: Save view of pane to image,Node
