How to read properties file in web application?,Thread
How to check if a string equals any elements in a previously defined string array,List
Get an Element by his attributes,Collections
How to print the content of an object,Object
How to put Objects from one map to another?,Map
How to develop screen capture to video application,Robot,ImageIO
"How can I sort a List of Pair<String,Integer>?",Collections
Exception when invoke reflection Class.getMethod,Method
how do i sort an array of objects via the comparable interface?,Arrays
Execute script in Java program at runtime,System,Runtime
reading and writing from sockets,Socket
Pattern for parsing date with two timezone format in Joda-Time,DateTimeFormatter
How to update a value in a map if it exists else insert it,HashMap
Applet method calling from Javascript,AccessController
How to load all file paths into a string array,File
Drawing shapes does not work in graphics2D,Component
How to store and retrieve milliseconds in a date object in Java?,Calendar,Date
ToolTip for own drawings,Graphics2D
Sorting a List of LIst by the Value of the sublist,Collections
How to list files and folders from path to tree?,DefaultMutableTreeNode
How to format a 3-digit integer to a 4-digit string?,String
how to format date using SimpleDateFormat,DateFormat
Best way to open and return a database connection in a Java application?,Class
Comparing two java.util.Dates to see if they are in the same day,Calendar
Passing Integer To Servlet,Integer,Long
How to read all files in directory iteratively in Java?,Files
Why Entry interface defines methods like equals and hashCode?,Entry
Convert Date to time stamp in java,Timestamp
How can I get rid of the black background on images captured with Robot?,MouseInfo
The text of the Label not changing in Java,Thread
Changing the Look and Feel changes the color of JTextPane?,UIManager
How to create multiple JSON objects via for loop,List
How can a socket be both connected and closed?,Socket
How to safely create a file if it doesn't exist from concurrently-running processes without using locking?,File,UUID
java: ArrayList - how can i check if an index exists?,Hashtable
How to include SQLite database in executable Jar?,Class
How to compare two Strings when both can be null?,Objects
Converting Epoch time to date string,SimpleDateFormat
Write a generic method to copy an array,Array
Rectangle Area and Perimeter,String,Formatter
Jtextfield tooltip update before text is committed,JTextComponent
Java: Moving JButtons vertically in a JPanel with BoxLayout,Box
How to create HashMap with streams overriding duplicates?,Collectors
How to insert data in map from a text file in java,Pattern
How to sort an array list according to different criteria?,Collections
How to draw part of a large BufferedImage?,Graphics
How would you convert each int element of a 2D Array into a String?,Integer
How to declare an ArrayList with values?,ArrayList,Stream
How can you detect a mouse-click event on an Image object in Java?,Shape
How to use the Comparator interface,Collections
How to draw String with background on Graphics?,Graphics,Graphics2D
Can I load a Java class in a way that automatically removes its privileges?,AccessController
Detect mouse click anywhere on window,Toolkit
Size of java.awt.Color object,serialized-form
Java Reflection invoking method NoSuchMethodException,String
How can I display an ArrayList in a JTextArea,TextArea
Java Graphics2D - draw an image with gradient opacity,AlphaComposite
Why can't I compare text from a TextArea to a String?,String
"given an input array and sum, return the minimum elements need to get sum",Integer
Finding roots of quadratic equation,Math
Java Date.parse or new Date(String) replacement?,DateFormat
How to execute VBS script in Java?,Runtime
Java Change shape of JPanel,JComponent
How to get x Coordinate of Shape Object in Java,Shape
how to compare date array values,Date,String
How to sort a list of class objects on one of its fields?,Collections
How do I pass a variable argument to instanceof?,Class
How to remove elements in an arraylist start from an indicated index,List
How do i change this method to get strings instead of ints,Scanner
How to write text into file without waiting for file closure,BufferedWriter
Wrap deflated data in gzip format,Deflater
How to unmarshall only child elements using JAXB?,Unmarshaller
"How to """"save"" the result in a text file in java",FileOutputStream
"Using Java, what is the best way to save an image to a file?",ImageIO
How can I use Java reflection to invoke a method on a reference variable?,Class
Java-How to draw pixels on a screen,Graphics
Connect TableView columns to the HashMap values,Map
Permission for reading System.in in java,SecurityManager,System
How to bind a socket to local wifi network address on Android?,Socket
Sort an ArrayList of semicolon separated values by a field,Collections
sorting a list of pair of integers in ascending order in java?,Collections
Best way to repeatedly load/remove multiple images on screen,ImageIO
"How to sort a List of Persons by first name, last name and so on?",Collections
How to format Milliseconds,String
jdbc ResultSet closed,ResultSet
How to download images asynchronously from web server,Runnable
How should I override equals and hashcode method to avoid adding equal objects o HashSet?,Object
Calling a method with an generic parameter with Java reflection,index
Sorting arraylist. Comparation by int value,Collections
Reverse the JSON array,Collections
JUnit tests kills daemon,System
Executing a Linux command in Terminal from Java,Runtime
Compare time offset Using Two Date objects,Instant
Java reflection - Where is the method inherited from?,Method
GZIP Compression & Decompression Issue,String
Java AWT rotating ball,Math
How can I get an address of a List?,System
Using the equals() method with String and Object in Java,String,Object
"mysqldump returns code 6 when run from java, but the same command works fine from command line",Runtime,Process
How to automatically close Java server?,ServerSocket
Java sort a Hashmap on Value,Collections
How can I change this code so that the command prompt closes when it finishes executing?,Runtime
How do I iterate over an Array field reflectively?,Field
How to convert timestamp string to epoch time?,DateTimeFormatter,ZoneId
"Sorting Map by Value, clarification needed",Integer
How to upload and download file to hdfs using Java code,ImageIO
How can I sort an ArrayList?,Collections
How do I cast from an Object[] to another array type?,Arrays,System
Java Swing : Failed to create resources from application bundle. Using Java-based resources,UIManager
Java client-side SSLSocket: How to tell if remote end has closed the connection?,Socket
"How to ""group by"" a list of objects by a class attribute in Java?",Collectors
"How to save, retrieve and draw an image in webapplication using Java and PostgreSQL?",ResultSet,PreparedStatement
Java Comparing Objects,Comparable
How do I convert a String representation of time into Unix time?,String
java.text.ParseException: Unparseable date Exception while converting timestamp value to time in java,DateFormat
"Java, How to convert decimal number as string into an integer",Double
Java Output Integers to File,BufferedWriter,Writer
Redirect stdout to a string in Java,System
How to sort List<List<String>>,Double
Get MAC address on local machine with Java,NetworkInterface
BigDecimal Subtraction,BigDecimal,Double
Get a list of classes lambdas,LambdaMetafactory
ArrayList of Two Classes,List
Swing Draw 1px border lines between components in a GridBagLayout component,BorderFactory,LineBorder
Rectangle border Java,Graphics2D,Graphics
How to convert a hexadecimal string to long in java?,Long
Truncate a list to a given number of elements,List
How to read x amount of characters from a text file,InputStream
How to overload equality and print in java?,PrintStream,Object
Why is the implementation of Object.equals() not using hashCode()?,Object,String
How to add a background image without removing components from screen? Java,JFrame
How do i set the text of a TextView to a value of an integer from another class,String
How do you search for an item in a LinkedLIst?,List
How to get a character from a number in Java,Character
How to transform a Map to a SortedMap by lambda expression in JAVA8?,Collectors
how and when HashMap initialize entrySet and add value into it,AbstractMap
Introspection of a Map,Class
Add Element to Document and find with XPath,Document
Java date comparator issue,Arrays
How to change the background color for JPanels with Nimbus Look and Feel?,UIManager
Can we call methods of non-static classes without an object in Java?,Integer
Get error output from Python script called from Java,Runtime
Image not drawing after sleep java,Thread
Sorting int array in descending order,Collections
Java Reflection get declared fields of unknown type SubClass,Class
Including image Icons in executable jar file,Class
How to sort an attribute of an object using Collections,Collections
Java: Getting photo click effect after screenshot,Thread
Sorting Custom Object Price Values in Ascending and Descending order,Integer
How to initialize all the elements of an array to any specific value in java,Arrays
How to get the rgb values of a jpeg image in TYPE_3BYTE_BGR?,Toolkit
How to add to SortedSet items from an Array?,Collections
How to get key position from a HashMap in Java,Map,List
How to sort linkedlist on some natural order?,Collections
Java monitor folder for files,File
Setting text background color?,JOptionPane
How do I send a GraphicsContext from a client to a server and then to all of the other clients?,Node,SwingFXUtils,ImageIO
Atomic Operation in Java to create a hardlink and delete a file,File
Comparing modifiers in Java,Modifier
how do you change the color of a jbutton after it is clicked?,SwingUtilities
Sort arraylist in random order,Random,Collections
JPA mapping 2 entity table with a relationship table between them,Collectors
Add item to final list,Arrays
JAX-RS How to get a cookie from a request?,Integer
Java application with embedded Derby database,System
How do i programmatically change file permissions?,Files
Execute multiple commands in command line using Java,Runtime
Running CMD from Java,ProcessBuilder
How to read/write extended ASCII characters as a string into ANSI coded text file in java,String
How to override the (final) equals method in java enums?,List,Collections
Code jumps to unknown class while executing method in backing bean,Collections
How do ColorModels and WritableRasters work in java BufferedImages?,Raster
How do I sort an array of strings based on different parts of each string?,Collections,Arrays
how to change jlabel text/color at runtime in swing aplicaiton,SwingUtilities
How do I use a variable instead of a string in the Pattern class?,Pattern
How to create an array of string vectors in Java?,Collections
Painting an Image using Graphics2D,JComponent
how to remove list element,Arrays
Sorting Array in Java by Arrays.sort;,Integer
How to Determine if 2 Circles Overlap,Math
Java how to sort a list of IP Address,Collections
Is there a simple way of parsing this text into a Map,Matcher
Java: Maze icons: what to do?,Thread
Cant Conect to MySql in java with properties file,DriverManager
Writing a remove method for a class implementing Iterable,Object,Iterator
How to traverse values of a generic Enum?,EnumSet
How to SELECTIVELY bold text in a TextView,String
Deep Copy an Object,Object
"Execute terminal command using "">"" in java",Runtime
How can I generate the same secure hash in Java and Ruby using PBKDF2,BigInteger,String
"How do I read in a public static, with variable data from a method, from another class and get updated data",String
How to add 20 pixels of white at the top of an existing image file?,GraphicsConfiguration,BufferedImage,Graphics
Unable to create thumbnails for large image files,ImageIO
Java Sorting Price Values Ascending and Descending,Integer
Days between two Dates,Calendar
Calling Methods Names from a List of Strings,Class
How do I sort a small list of items based on a master sequence list of items?,List
How to get a limited number of values from a HashMap or LinkedHashMap?,Collections
How do I convert int into char[] to display time?,String
How do I set the folder for storing file uploads using Commons FileUpload,File
How to convert text file in order to be placed in my acharengine array?,Integer
Fastest way to read/write Images from a File into a BufferedImage?,ImageIO,Files
How can I get an element type class from an array type class?,Class
Change image on JButton on mouse over,AbstractButton
Collections.reverse method not reversing entry,Collections
How to change the position of a RadioButton's label?,Labeled
Use Objects.hash() or own hashCode() implementation?,Objects
How to encrypt URL request parameter values in java for use in an emailed link,Cipher
creating inner class objects with reflection,Constructor,Class
IP Address With Java,InetAddress,NetworkInterface
How do I get a Java resource as a File?,ClassLoader
Not able to run cmd command through java,ProcessBuilder
JavaFX: Apply text color to TableCell using custom style sheet?,cssref
Use of getReturnType() of Java's reflection to create a new object of that type,Method,Class,Constructor
How Can I Correctly Format a String In Java?,String
Create image from pixel array in java,ImageIO
How to split a string in Java,String,Pattern
Java8 parse date or date time format for a given string,ChronoField
How to change value of range of index of an array?,Arrays
How to use Java DB (named Derby) with hibernate,System
Styling text in a JTextArea or JTextPane,JEditorPane
What is the method invoked when I use this method call in Java?,Container
How to construct a new array given an old array and a set of index locations which need to skipped?,System
How to convert an int[] array to a List?,Arrays
How to store an array returned by a method in Java,System
Parsing xml file error,DocumentBuilder
javascript date to java date field,Long,Date
Java: How to decompress files (zip or tar.gz) with low memory usage?,ZipInputStream
Creating a draw rectangle (filled with black color) function in Java for a grid,Graphics
Enum reflection,Class
Unable to load RSA public key,Security
JSP Servlet login issues,Class
How to read from a file not in Eclipse in Java,ClassLoader
Adding from ArrayList to another ArrayList from a given index,Collections
How to get the node as well as node values using XPath,Node
java.lang.ClassCastException when casting Object-result of java.lang.reflect.Method.invoke,URLClassLoader
Call the method on my customer JPanel for changing label for all JInternalFrames in JFrame,JDesktopPane,BorderLayout
Java graphics drawing doesn't show up on drawing panel,Canvas
How can I handle when I change the screen,SwingUtilities
Running shell script from java - doesn't finish task,Runtime
Recursive vowel counter,Character
changing a string of numbers into an int from a part of a parsed string,Integer,Double
How do I sort an ArrayList of Objects?,Collections,Integer,Arrays
How can I sort a IntStream in ascending order?,IntStream
Send Command to http server,HttpExchange
How to remove white space between two characters from a line from text file,String
Java - when changing from jre 1.6 to 1.7 DocumentBuildFactory fails,DocumentBuilderFactory
How to create a array with String array and a String,System
How to pass a file location as a parameter as a string?,Class
Sorting a list of strings,Collections
Writing HashMap contents to the file,Files
java.lang.IllegalArgumentException: object is not an instance of declaring class when I use reflection,Method
Saving and retrieving Date in GMT timezone and converting to String,ZoneId,DateTimeFormatter
How to find a key that corresponds to a value in a hashmap without iterating the table (Java),Map
Java the difference of Socket and ServerSocket in using port,ServerSocket
JAVA java.lang.reflect.Constructor cannot call Date constructor,Date,Constructor
H2 DB: How to check whether table schema is initialized programmatically?,DatabaseMetaData
How do I get a subclass to use a parent class' protected methods?,Class
How to draw moving and Running sine wave chart using JFree chart in java?,Math
Java Image Resize BufferedImage doesn't draw,ImageIO
How can I add buttons on a picture?,Graphics
How to parse String to an object,Class
RC4 encryption java,String,Cipher
Using java.lang.reflect.getMethod with polymorphic methods,Class
How do I create an empty Stream in Java?,Stream
JUnit test case failure,Math
How do I use SwingWorker in Java?,SwingUtilities
Screen not created for drawstring text to display,Thread
SSL Server socket want auth option,SSLSocket
Zlib compression is too big in size,OutputStream
JavaFX change color of ImageView,cssref
Using ClassLoader when loading .jar resources,Class,ClassLoader
Convert a date format in epoch,Date
Create a Shape Object from Font Object in Java,GlyphVector
Can Joda format dates for Arabic locale using Arabic digits?,String
How to determine bufferedimage color type in java,BufferedImage,ColorModel
PostgreSQL: How to insert data into database table with loop?,Statement
How to send java.util.Date in Json?,Date
How to implement .png pics in a JFrame?,ImageIO,Toolkit
Using an ArrayList in Java,String,Arrays
How to remove an item from a List<Integer> that is inside an array?,Arrays
Draw triangle with rounded corner,Graphics2D
Java: Objects in collections,Vector
Pacman in Java questions,Thread
How to remove an element from set using Iterator?,Iterator
How to overcome the hanging of TCP client when TCP server is not running?,Socket
Opening a PDF file that is packaged in a JAR,ClassLoader
How to get a specific entry from a custom ArrayList?,ArrayList
Sorting array to get specified element at index 0 of it,Arrays
Java: How to merge the keys of two maps?,List,HashMap
how do i turn a array of integers into a vector?,Arrays
JAXB nodes to map,Unmarshaller,Marshaller
How can I fake the date returned by java.time.LocalDate?,LocalDate
How to divide a sentence into parts Java?,String
Get contents of a directory in a ZIP file in Java,JarFile
Can I pass complex parameters to a Java Applet?,String
Sort enumeration values by name,Arrays
How to draw a circle with OpenGL(LWJGL specifically) using VBOs,Math
Sort HashMap keys and store in ArrayList,Collections
Java DOM How to check if node exists in XML,Element,NodeList
Quick way of creating a random subset of an array using IntStream,Random,IntStream
How can I set the global default date format in Java?,Locale
java - Calling a PL/SQL Stored Procedure With Arrays,Connection
How to apply contains function on attribute of a Java Object?,Stream
How to convert a LocalDate to an Instant?,LocalDate
Java: How do I set a maximum length for a Double?,String
Convert string to json object gives an error,Collections
Why Java implement different hashcode method of Set and ArrayList?,Set,List
jar resource loads in test but not in application,Class,ClassLoader,URL
Save XML to a relative file location.,JAXB
java access resource files from class loaded by another classloader,Class,ClassLoader
Comparing strings in java android,String
"If I have a specific date of a day, how do I get the date of that day in the previous week?",LocalDate
Drawing shapes on a JForm java,SwingUtilities
Changing JButton Text or color without final?,EventObject
"IN Java Graphics2D, how can text be center aligned on a Rectangle?",FontMetrics
How do I Create a java.sql.Date variable?,Date
How do I set a Java Calendar to a specific UTC time?,DateFormat
How to read a single word (or line) from a text file Java?,String
change string to date as per the required date Format,Date,DateFormat
Are joda timezone ids the same as java time zone ids?,ZoneId,TimeZone
How to return a copy of an array?,Arrays,System,Object
MessageDigest digest() method,Object
Reflectively instantiate class with constructor which takes Enum,Class
How to insert a column at a specific position in JTable,JTable,DefaultTableModel
Passing a String array in Java command line arguments,System
Getting a date and time input in Eastern Time and converting to UTC timestamp in Java,LocalDateTime,Timestamp,Instant
Setting host address of rmi object,RemoteObject
How can I access String members of an arrayList to concatenate to them?,String
Error: sun.awt.image.ToolkitImage cannot be cast to java.awt.image.BufferedImage,Toolkit,ImageIO
Servlet get date and time,TimeZone
How do I find/list a file or directory with specific name inside a directory and its subdirectories in Java?,Files
Array/List of class names,Class
How to use Collections in java to sort list populated from a class,Collections
Reading every char in a text file,BufferedReader
Java sax parser bug,ContentHandler
Java Port Scanner is Missing Open Ports,Socket
Translucent components inside JPanel,Graphics
Java Draw All Glyths of a Font,Font,Character
Secure FTP using private key authentication,File
Sort collections with objects with float value,Math
Basic authentication with HTTPS,HttpsURLConnection
Add text file and images to build in the Jar - Netbeans,ImageIO
How does a Set determine the order of its values?,Set
How to get default ZoneOffset in java8?,ZoneId,OffsetDateTime
Trouble using mouse to click on JComponent,Component,SwingUtilities
Read data in line into string array?,String
How I change a value of a sepecific attribute in all object of LIST,ArrayList
how do you implement the equality and hashCode method if the class has reference type members java?,Point
How can I get white colored pixel value from gray scale image and replace it with another color?,ImageIO
How to add elements of a Java8 stream into an existing List,Collector,Collectors,List,ArrayList
JAVA not in gzip format error,Files
Executing shell script from java code and check if execution has passed,Process
Generate a key for AES,KeyGenerator
How to cast a String value to an Enum value by Class?,Enum,Class
copying char to char array reverse,StringBuffer
how to parse String dateformat to only time,Date
How can I set the program time in seconds?,System
Java Change File Working Directory,System
How to represent a 5 letter string as digit?,Integer
Execute external program from Java,Runtime
how to change color in HSB color system,Color
Why is it useful to have null values or null keys in hash maps?,Hashtable,HashMap
comparing the values of two Integers,Integer
Reading and checking values from an array,Arrays
Hightlight and change Color of Text in JTextArea,JComponent
Java - a single generic method to reverse ArrayList or List of objects,Collections
Parsing a DateTime in a time-zone,ChronoZonedDateTime
Java Applet - Drawing Polygons - Reading RGB,Robot
How to pass parameter to shell script in java program,Runtime
"create multiple files do loop with java and store in a drive , how to?",File
Reading a file in Servlet program,Files
How can I shutdown CompletionService,ExecutorService
cast Object to Comparable in java,Array
how to save RSS to xml file java,URL,URLConnection
how do I ignore/delete values of an array in java,Arrays
How can I convert a java String to map?,Map
Java - Reflection. Set value for the class object which are dynamically created,Field
Many versions of JDK: How do I specify which one is used?,String
Classpath resource within jar,Class,ClassLoader
"Java, how to change current database to another?",Connection
Java - Draw a ruler (line with tick marks at 90 degree angle),Math,Graphics
How do I convert the date from one format to another date object in another format without using any deprecated classes?,SimpleDateFormat
How do I do this with string in Java?,String
"How to get line height for a font, like in JTextArea?",FontMetrics
Why Executors create Executor use LinkedBlockingQueue instead of ConcurrentLinkedQueue,ThreadPoolExecutor,BlockingQueue
How to execute Python script from Java?,Runtime
How to compare List count against single integer value?,Integer
"Java Reflection - Getting value of nested object, list and array within object",Class,Field
How to Sort Date in descending order From Arraylist Date in android?,Collections
Will you get descending order if you reverse list of objects which is sorted by ascending order?,Collections
Java Socket Reuse,Socket
Array sort and print reversed,Arrays,Collections
String date to universal time convertion java,Date
How do I execute a perl script in java?,Runtime
How to change the color of | of JTextField,JTextComponent
Returning values from a java program back to a batch file,System
Why changes in sublist are reflected in the original list?,List
Read from file before specific character in java,String
Print each word from this sentence,String
Unable to execute Unix command through Java code,Runtime
How to sort a text file and save it using java?,Pattern
When should I use SynchronousQueue,Executors
How to change default directory for creating new files,System
Make a deep copy with clone,Object
How to sort a HashMap by Keys and then Values?,Collections
java - how do jcomponents draw?,Component,ButtonModel
how do i count occurrence of words in a line,String
How can I correctly parse this specific Date?,OffsetDateTime
Sort by array elements,Arrays,Collections
How to use Comparator with a multiple field object?,Collections
Print Writer does corrupt files when its used to upload files to a server,PrintWriter,FileOutputStream
How to convert object array to string array in Java,System
How to format strings in Java,MessageFormat
